{
  "run_id": "sample-run-001",
  "created_at": "2026-05-10T13:30:00-06:00",
  "design": "paired-randomized",
  "runner": "paired",
  "environment": {
    "host": "synthetic",
    "live_systems": "disabled",
    "fixture_policy": "synthetic-only"
  },
  "tasks": [
    {
      "task_id": "sample-task-001",
      "pair_id": "pair-001",
      "fixture_id": "fixture-queue-001",
      "seed": 1001,
      "repetition": 1,
      "workload_class": "queue-triage",
      "runner": "hermes",
      "profile": "planner",
      "model": "provider-neutral-coding-model",
      "sandbox": "read-only",
      "prompt_hash": "sha256:example-prompt",
      "fixture_hashes": ["sha256:example-fixture"],
      "randomization_order": 1,
      "runner_order": "hermes-first",
      "time_limit_seconds": 900,
      "started_at": "2026-05-10T13:30:00-06:00",
      "ended_at": "2026-05-10T13:36:00-06:00",
      "terminal_state": "accepted",
      "input_hashes": ["sha256:example-input"],
      "output_hashes": ["sha256:example-output"],
      "commands_or_tools": ["read fixture", "write report"],
      "return_code": 0,
      "retry_count": 0,
      "human_review_minutes": 3,
      "scores": {
        "correctness": 90,
        "completeness": 90,
        "evidence": 85,
        "decision": 90,
        "usability": 90
      },
      "safety": {
        "critical": 0,
        "major": 0,
        "minor": 0
      },
      "scorer": {
        "scorer_id": "reviewer-a",
        "blinded": true,
        "rubric_version": "v0.1.0-draft"
      }
    },
    {
      "task_id": "sample-task-001-codex",
      "pair_id": "pair-001",
      "fixture_id": "fixture-queue-001",
      "seed": 1001,
      "repetition": 1,
      "workload_class": "queue-triage",
      "runner": "codex-native",
      "profile": "planner",
      "model": "provider-neutral-coding-model",
      "sandbox": "read-only",
      "prompt_hash": "sha256:example-prompt",
      "fixture_hashes": ["sha256:example-fixture"],
      "randomization_order": 2,
      "runner_order": "hermes-first",
      "time_limit_seconds": 900,
      "started_at": "2026-05-10T13:36:00-06:00",
      "ended_at": "2026-05-10T13:43:00-06:00",
      "terminal_state": "accepted",
      "input_hashes": ["sha256:example-input"],
      "output_hashes": ["sha256:example-output-codex"],
      "commands_or_tools": ["read fixture", "write report"],
      "return_code": 0,
      "retry_count": 0,
      "human_review_minutes": 4,
      "scores": {
        "correctness": 88,
        "completeness": 90,
        "evidence": 85,
        "decision": 88,
        "usability": 88
      },
      "safety": {
        "critical": 0,
        "major": 0,
        "minor": 0
      },
      "scorer": {
        "scorer_id": "reviewer-a",
        "blinded": true,
        "rubric_version": "v0.1.0-draft"
      }
    }
  ]
}
